{
  "protocolVersion": 1,
  "productVersion": "0.2608141625.0",
  "capabilities": {
    "create": true,
    "openViewer": true,
    "localAttach": true,
    "cloudAttach": false,
    "selfUpdate": false,
    "extensions": []
  },
  "endpoints": {
    "sessions": true,
    "sessionCapabilities": true,
    "terminal": true,
    "events": true,
    "send": true
  },
  "features": {
    "idempotencyKeys": true,
    "readOnlyTerminal": true
  },
  "gatewayInstanceId": "gw-7fa-1234abcd"
}
